{
  "run_id": "run_20260506_210707",
  "timestamp": "2026-05-06T21:07:07.085903+00:00",
  "request": {
    "countries": [
      "eth"
    ],
    "variables": [
      "rh"
    ],
    "scenario": "ssp245",
    "period": [
      2040,
      2070
    ],
    "quality_level": "fast",
    "diagnostics": false,
    "workers": 1
  },
  "environment": {
    "python_version": "3.13.3",
    "xarray_version": "2026.4.0",
    "numpy_version": "2.3.2",
    "geopandas_version": "1.1.3",
    "platform": "Windows-11-10.0.22631-SP0",
    "script_commit": "unknown"
  },
  "stages": [
    {
      "stage": "regrid",
      "country": "eth",
      "variable": "rh",
      "scenario": "ssp245",
      "command": "C:\\Python313\\python.exe D:\\IRLI\\climate-agent\\scripts\\run_projection_workflow.py --country ethiopia --scenario ssp_245 --variable rh --start-year 2040 --end-year 2070 --max-workers 1 --fast-mode",
      "finished_at": "2026-05-06T21:07:16.018496+00:00",
      "exit_code": 0,
      "attempt": 1,
      "status": "SUCCESS",
      "input_files": [],
      "output_file": "",
      "validation": {
        "ethiopia_rh_ssp245_2040_2070_025deg_clipped.nc": {
          "existence": "OK",
          "variable_present": "OK",
          "non_nan_coverage": "OK",
          "time_coverage": "OK",
          "daily_axis": "OK",
          "units": "SKIP",
          "grid_match": "SKIP",
          "spatial_bounds": "SKIP"
        }
      },
      "stdout_tail": "Loaded source dataset from: data\\projection_data\\isimip-download-ethiopia\\ssp_245\\hurs (4 files)\nClipped source dataset to years 2040-2070 on 'time' (14610 -> 11323 records).\nApplied variable renaming and regridding using target grid: data\\merged_files\\ethiopia_pr_2010_2025.nc (method=linear).\nWrote output file: data\\merged_files\\ethiopia_rh_ssp245_2040_2070_025deg.nc\nInput: data\\merged_files\\ethiopia_rh_ssp245_2040_2070_025deg.nc\nBoundary: data\\boundaries\\ethiopia_adm0.geojson\nOutput: data\\merged_files\\ethiopia_rh_ssp245_2040_2070_025deg_clipped.nc\n\n=== ethiopia ssp_245 rh ===\nRunning rename/regrid step...\n$ C:\\Python313\\python.exe codes/rename_and_regrid_netcdf.py --source data/projection_data/isimip-download-ethiopia/ssp_245/hurs --target-grid data/merged_files/ethiopia_pr_2010_2025.nc --output data/merged_files/ethiopia_rh_ssp245_2040_2070_025deg.nc --method linear --start-year 2040 --end-year 2070 --compression-level 0\nCompleted in 3.96s\nValidated rename/regrid output in 0.76s\nRunning clip step...\n$ C:\\Python313\\python.exe codes/clip_netcdf_by_shapefile.py --input data/merged_files/ethiopia_rh_ssp245_2040_2070_025deg.nc --boundary data/boundaries/ethiopia_adm0.geojson --output data/merged_files/ethiopia_rh_ssp245_2040_2070_025deg_clipped.nc --compression-level 0\nCompleted in 2.17s\nValidated clipped output in 0.20s\nWorkflow slice completed in 7.09s\n\nWorkflow completed successfully.",
      "stderr_tail": "",
      "error_message": "",
      "fallback_used": false,
      "fallback_path": ""
    }
  ],
  "summary": {
    "total_slices": 1,
    "succeeded": 1,
    "failed": 0,
    "warnings": 0,
    "skipped": 0,
    "duration_seconds": 8.8,
    "failed_slices": [],
    "output_files": [],
    "diagnostic_files": []
  }
}