{
  "run_id": "run_20260507_203252",
  "timestamp": "2026-05-07T20:32:52.986015+00:00",
  "request": {
    "countries": [
      "eth"
    ],
    "variables": [
      "tas"
    ],
    "scenario": "historical",
    "period": [
      2010,
      2020
    ],
    "quality_level": "strict",
    "diagnostics": false,
    "workers": 1,
    "diagnostics_only": false
  },
  "environment": {
    "python_version": "3.13.3",
    "xarray_version": "2026.4.0",
    "numpy_version": "2.3.2",
    "geopandas_version": "1.1.3",
    "platform": "Windows-11-10.0.22631-SP0",
    "script_commit": "6cc5098",
    "agent_config_hash": "sha256:d6a2f74e929301d6"
  },
  "stages": [
    {
      "stage": "merge",
      "country": "eth",
      "variable": "tas",
      "scenario": "historical",
      "command": "C:\\Python313\\python.exe D:\\IRLI\\climate-agent\\scripts\\run_historical_workflow.py --country ethiopia --variable temp --start-year 2010 --end-year 2020 --max-workers 1",
      "finished_at": "2026-05-07T20:33:07.024054+00:00",
      "exit_code": 143,
      "attempt": 1,
      "status": "FAILED",
      "input_files": [],
      "output_file": "",
      "validation": {},
      "stdout_tail": "=== ethiopia historical temp ===\nRunning merge step...\n$ C:\\Python313\\python.exe codes/merge_netcdf_ethiopia_temperature.py --input-dir data/ethiopia_temperature/netcdf --output data/merged_files/ethiopia_temp_2010_2020.nc",
      "stderr_tail": "",
      "error_message": "Tool run_historical_workflow.py failed after 1 attempt(s). Last stderr: ",
      "fallback_used": false,
      "fallback_path": ""
    }
  ],
  "summary": {
    "total_slices": 1,
    "succeeded": 0,
    "failed": 1,
    "warnings": 0,
    "skipped": 0,
    "duration_seconds": 14.0,
    "failed_slices": [
      {
        "country": "eth",
        "variable": "tas",
        "scenario": "historical",
        "stage": "merge",
        "reason": "Tool run_historical_workflow.py failed after 1 attempt(s). Last stderr: "
      }
    ],
    "output_files": [],
    "diagnostic_files": []
  }
}