{
  "run_id": "run_20260507_210607",
  "timestamp": "2026-05-07T21:06:07.683766+00:00",
  "request": {
    "countries": [
      "eth"
    ],
    "variables": [
      "tas"
    ],
    "scenario": "historical",
    "period": [
      2010,
      2025
    ],
    "quality_level": "strict",
    "diagnostics": false,
    "workers": 1,
    "diagnostics_only": false
  },
  "environment": {
    "python_version": "3.13.3",
    "xarray_version": "2026.4.0",
    "numpy_version": "2.3.2",
    "geopandas_version": "1.1.3",
    "platform": "Windows-11-10.0.22631-SP0",
    "script_commit": "6cc5098",
    "agent_config_hash": "sha256:cf198da6eef2f90b"
  },
  "stages": [
    {
      "stage": "merge",
      "country": "eth",
      "variable": "tas",
      "scenario": "historical",
      "command": "(skipped \u2014 outputs exist)",
      "finished_at": "2026-05-07T21:06:07.760498+00:00",
      "exit_code": 0,
      "attempt": 1,
      "status": "SKIPPED",
      "input_files": [],
      "output_file": "",
      "validation": {},
      "stdout_tail": "",
      "stderr_tail": "",
      "error_message": "",
      "fallback_used": false,
      "fallback_path": ""
    }
  ],
  "summary": {
    "total_slices": 1,
    "succeeded": 0,
    "failed": 0,
    "warnings": 0,
    "skipped": 1,
    "duration_seconds": 0.0,
    "failed_slices": [],
    "output_files": [
      "D:\\IRLI\\climate-agent\\data\\merged_files\\ethiopia_temp_2010_2025_025deg_clipped.nc"
    ],
    "diagnostic_files": []
  }
}