{
  "run_id": "run_20260507_143018",
  "timestamp": "2026-05-07T14:30:18.565189+00:00",
  "request": {
    "countries": [
      "eth"
    ],
    "variables": [
      "rh"
    ],
    "scenario": "ssp245",
    "period": [
      2040,
      2070
    ],
    "quality_level": "fast",
    "diagnostics": true,
    "workers": 1
  },
  "environment": {
    "python_version": "3.13.3",
    "xarray_version": "2026.4.0",
    "numpy_version": "2.3.2",
    "geopandas_version": "1.1.3",
    "platform": "Windows-11-10.0.22631-SP0",
    "script_commit": "unknown"
  },
  "stages": [
    {
      "stage": "regrid",
      "country": "eth",
      "variable": "rh",
      "scenario": "ssp245",
      "command": "C:\\Python313\\python.exe D:\\IRLI\\climate-agent\\scripts\\run_projection_workflow.py --country ethiopia --scenario ssp_245 --variable rh --start-year 2040 --end-year 2070 --max-workers 1 --fast-mode --run-diagnostics",
      "finished_at": "2026-05-07T14:30:32.310520+00:00",
      "exit_code": 0,
      "attempt": 1,
      "status": "SUCCESS",
      "input_files": [],
      "output_file": "",
      "validation": {
        "ethiopia_rh_ssp245_2040_2070_025deg_clipped.nc": {
          "existence": "OK",
          "variable_present": "OK",
          "non_nan_coverage": "OK",
          "time_coverage": "OK",
          "daily_axis": "OK",
          "units": "SKIP",
          "grid_match": "SKIP",
          "spatial_bounds": "SKIP",
          "anomaly": "OK",
          "distribution": "OK"
        }
      },
      "stdout_tail": "- Value max: 99.3214\n- Value mean \u00b1 std: 57.6185 \u00b1 17.6768\n- Diagnostic plot written to: data\\merged_files_et\\diagnostics\\ethiopia_rh_ssp245_2040_2070_025deg_clipped_diagnostic.png\n- QC JSON sidecar written to: data\\merged_files_et\\diagnostics\\ethiopia_rh_ssp245_2040_2070_025deg_clipped_qc.json\n\n=== ethiopia ssp_245 rh ===\nRunning rename/regrid step...\n$ C:\\Python313\\python.exe codes/rename_and_regrid_netcdf.py --source data/projection_data/isimip-download-ethiopia/ssp_245/hurs --target-grid data/merged_files/ethiopia_pr_2010_2025.nc --output data/merged_files/ethiopia_rh_ssp245_2040_2070_025deg.nc --method linear --start-year 2040 --end-year 2070 --compression-level 0\nCompleted in 3.65s\nValidated rename/regrid output in 0.88s\nRunning clip step...\n$ C:\\Python313\\python.exe codes/clip_netcdf_by_shapefile.py --input data/merged_files/ethiopia_rh_ssp245_2040_2070_025deg.nc --boundary data/boundaries/ethiopia_adm0.geojson --output data/merged_files/ethiopia_rh_ssp245_2040_2070_025deg_clipped.nc --compression-level 0\nCompleted in 1.94s\nValidated clipped output in 0.17s\nRunning diagnostics step...\n$ C:\\Python313\\python.exe codes/diagnose_final_netcdf.py --file data/merged_files/ethiopia_rh_ssp245_2040_2070_025deg_clipped.nc --var rh --time-index 6416 --out-dir data/merged_files_et/diagnostics\nCompleted in 4.97s\nWorkflow slice completed in 11.69s\n\nWorkflow completed successfully.",
      "stderr_tail": "",
      "error_message": "",
      "fallback_used": false,
      "fallback_path": ""
    }
  ],
  "summary": {
    "total_slices": 1,
    "succeeded": 1,
    "failed": 0,
    "warnings": 0,
    "skipped": 0,
    "duration_seconds": 18.1,
    "failed_slices": [],
    "output_files": [
      "D:\\IRLI\\climate-agent\\data\\merged_files\\ethiopia_rh_ssp245_2040_2070_025deg_clipped.nc"
    ],
    "diagnostic_files": [
      "D:\\IRLI\\climate-agent\\data\\diagnostics\\run_20260507_143018\\ethiopia_rh_ssp245_2040_2070_025deg_clipped_diagnostic.png"
    ],
    "qc_stats": {
      "ethiopia_rh_ssp245_2040_2070_025deg_clipped.nc": {
        "generated_at": "2026-05-07T14:30:35.925582+00:00",
        "file_variable": "rh",
        "units": "%",
        "dims": {
          "time": 11323,
          "lat": 45,
          "lon": 59
        },
        "grid": {
          "lat_step_deg": 0.25,
          "lon_step_deg": 0.25,
          "lat_direction": "ascending",
          "lon_direction": "ascending",
          "lat_min": 3.625,
          "lat_max": 14.625,
          "lon_min": 33.125,
          "lon_max": 47.625
        },
        "time": {
          "n_timesteps": 11323,
          "n_unique": 11323,
          "duplicate_count": 0,
          "missing_years": [],
          "n_missing_years": 0
        },
        "coverage": {
          "total_pixels": 30062565,
          "finite_pixels": 16735394,
          "nan_pixels": 13327171,
          "finite_ratio": 0.5567
        },
        "value_stats": {
          "min": 5.3271,
          "p01": 20.8486,
          "p05": 29.4943,
          "p25": 43.9595,
          "median": 56.5843,
          "p75": 72.9008,
          "p95": 85.0358,
          "p99": 88.9239,
          "max": 99.3214,
          "mean": 57.6185,
          "std": 17.6768
        },
        "missing_fraction_by_timestep": {
          "min": 0.4433,
          "max": 0.4433,
          "mean": 0.4433,
          "n_timesteps_above_20pct": 11323,
          "n_timesteps_above_50pct": 0
        },
        "source_file": "D:\\IRLI\\climate-agent\\data\\merged_files\\ethiopia_rh_ssp245_2040_2070_025deg_clipped.nc"
      }
    }
  }
}