{
  "run_id": "run_20260507_202952",
  "timestamp": "2026-05-07T20:29:52.684440+00:00",
  "request": {
    "countries": [
      "eth"
    ],
    "variables": [
      "tas"
    ],
    "scenario": "historical",
    "period": [
      2010,
      2020
    ],
    "quality_level": "strict",
    "diagnostics": false,
    "workers": 1,
    "diagnostics_only": false
  },
  "environment": {
    "python_version": "3.13.3",
    "xarray_version": "2026.4.0",
    "numpy_version": "2.3.2",
    "geopandas_version": "1.1.3",
    "platform": "Windows-11-10.0.22631-SP0",
    "script_commit": "6cc5098",
    "agent_config_hash": "sha256:d6a2f74e929301d6"
  },
  "stages": [
    {
      "stage": "merge",
      "country": "eth",
      "variable": "tas",
      "scenario": "historical",
      "command": "C:\\Python313\\python.exe D:\\IRLI\\climate-agent\\scripts\\run_historical_workflow.py --country ethiopia --variable temp --start-year 2010 --end-year 2020 --max-workers 1",
      "finished_at": "2026-05-07T21:04:13.456806+00:00",
      "exit_code": 1,
      "attempt": 3,
      "status": "FAILED",
      "input_files": [],
      "output_file": "",
      "validation": {},
      "stdout_tail": "Found 5844 files\nMerged file written to: data\\merged_files\\ethiopia_temp_2010_2020.nc\nTime steps: 5844\n\n=== ethiopia historical temp ===\nRunning merge step...\n$ C:\\Python313\\python.exe codes/merge_netcdf_ethiopia_temperature.py --input-dir data/ethiopia_temperature/netcdf --output data/merged_files/ethiopia_temp_2010_2020.nc\nCompleted in 10m 9.7s",
      "stderr_tail": "    process_work_item(work_item, args)\n    ~~~~~~~~~~~~~~~~~^^^^^^^^^^^^^^^^^\n  File \"D:\\IRLI\\climate-agent\\scripts\\run_historical_workflow.py\", line 343, in process_work_item\n    process_one(country, variable, args)\n    ~~~~~~~~~~~^^^^^^^^^^^^^^^^^^^^^^^^^\n  File \"D:\\IRLI\\climate-agent\\scripts\\run_historical_workflow.py\", line 253, in process_one\n    validate_output(\n    ~~~~~~~~~~~~~~~^\n        paths[\"raw_output\"],\n        ^^^^^^^^^^^^^^^^^^^^\n    ...<3 lines>...\n        end_year=args.end_year,\n        ^^^^^^^^^^^^^^^^^^^^^^^\n    )\n    ^\n  File \"D:\\IRLI\\climate-agent\\scripts\\run_projection_workflow.py\", line 264, in validate_output\n    raise ValueError(\n        f\"Time range mismatch for {output_path.name}: {int(years.min())}-{int(years.max())}\"\n    )\nValueError: Time range mismatch for ethiopia_temp_2010_2020.nc: 2010-2025",
      "error_message": "Tool run_historical_workflow.py failed after 3 attempt(s). Last stderr:   )\n    ^\n  File \"D:\\IRLI\\climate-agent\\scripts\\run_projection_workflow.py\", line 264, in validate_output\n    raise ValueError(\n        f\"Time range mismatch for {output_path.name}: {int(years.min())}-{int(years.max())}\"\n    )\nValueError: Time range mismatch for ethiopia_temp_2010_2020.nc: 2010-2025",
      "fallback_used": false,
      "fallback_path": ""
    }
  ],
  "summary": {
    "total_slices": 1,
    "succeeded": 0,
    "failed": 1,
    "warnings": 0,
    "skipped": 0,
    "duration_seconds": 2060.7,
    "failed_slices": [
      {
        "country": "eth",
        "variable": "tas",
        "scenario": "historical",
        "stage": "merge",
        "reason": "Tool run_historical_workflow.py failed after 3 attempt(s). Last stderr:   )\n    ^\n  File \"D:\\IRLI\\climate-agent\\scripts\\run_projection_workflow.py\", line 264, in validate_output\n    raise ValueError(\n        f\"Time range mismatch for {output_path.name}: {int(years.min())}-{int(years.max())}\"\n    )\nValueError: Time range mismatch for ethiopia_temp_2010_2020.nc: 2010-2025"
      }
    ],
    "output_files": [],
    "diagnostic_files": []
  }
}