{
  "run_id": "run_20260508_103743",
  "timestamp": "2026-05-08T10:37:44.205132+00:00",
  "request": {
    "countries": [
      "eth"
    ],
    "variables": [
      "pr"
    ],
    "scenario": "historical",
    "period": [
      2010,
      2025
    ],
    "quality_level": "strict",
    "diagnostics": true,
    "workers": 1,
    "diagnostics_only": false
  },
  "environment": {
    "python_version": "3.13.3",
    "xarray_version": "2026.4.0",
    "numpy_version": "2.4.4",
    "geopandas_version": "1.1.3",
    "platform": "Windows-11-10.0.22631-SP0",
    "script_commit": "efe67fc",
    "agent_config_hash": "sha256:cf198da6eef2f90b"
  },
  "stages": [
    {
      "stage": "merge",
      "country": "eth",
      "variable": "pr",
      "scenario": "historical",
      "command": "(skipped \u2014 outputs exist)",
      "finished_at": "2026-05-08T10:37:44.362179+00:00",
      "exit_code": 0,
      "attempt": 1,
      "status": "SKIPPED",
      "input_files": [],
      "output_file": "",
      "validation": {},
      "stdout_tail": "",
      "stderr_tail": "",
      "error_message": "",
      "fallback_used": false,
      "fallback_path": ""
    }
  ],
  "summary": {
    "total_slices": 1,
    "succeeded": 0,
    "failed": 0,
    "warnings": 0,
    "skipped": 1,
    "duration_seconds": 13.6,
    "failed_slices": [],
    "output_files": [
      "D:\\IRLI\\climate-agent\\data\\merged_files\\ethiopia_pr_2010_2025_025deg_clipped.nc"
    ],
    "diagnostic_files": [
      "D:\\IRLI\\climate-agent\\data\\diagnostics\\run_20260508_103743\\ethiopia_pr_2010_2025_025deg_clipped_diagnostic.png"
    ],
    "qc_stats": {
      "ethiopia_pr_2010_2025_025deg_clipped.nc": {
        "generated_at": "2026-05-08T10:37:57.326985+00:00",
        "file_variable": "precip",
        "units": "mm/day",
        "dims": {
          "time": 5844,
          "lat": 45,
          "lon": 59
        },
        "grid": {
          "lat_step_deg": 0.25,
          "lon_step_deg": 0.25,
          "lat_direction": "ascending",
          "lon_direction": "ascending",
          "lat_min": 3.625,
          "lat_max": 14.625,
          "lon_min": 33.125,
          "lon_max": 47.625
        },
        "time": {
          "n_timesteps": 5844,
          "n_unique": 5844,
          "duplicate_count": 0,
          "missing_years": [],
          "n_missing_years": 0
        },
        "coverage": {
          "total_pixels": 15515820,
          "finite_pixels": 8608212,
          "nan_pixels": 6907608,
          "finite_ratio": 0.5548
        },
        "value_stats": {
          "min": 0.0,
          "p01": 0.0,
          "p05": 0.0,
          "p25": 0.0,
          "median": 0.0,
          "p75": 0.8443,
          "p95": 14.4296,
          "p99": 27.6466,
          "max": 238.9802,
          "mean": 2.3226,
          "std": 5.8316
        },
        "missing_fraction_by_timestep": {
          "min": 0.4452,
          "max": 0.4452,
          "mean": 0.4452,
          "n_timesteps_above_20pct": 5844,
          "n_timesteps_above_50pct": 0
        },
        "source_file": "D:\\IRLI\\climate-agent\\data\\merged_files\\ethiopia_pr_2010_2025_025deg_clipped.nc"
      }
    }
  }
}