{
  "run_id": "run_20260506_223547",
  "timestamp": "2026-05-06T22:35:47.997607+00:00",
  "request": {
    "countries": [
      "eth"
    ],
    "variables": [
      "tas"
    ],
    "scenario": "historical",
    "period": [
      2010,
      2025
    ],
    "quality_level": "strict",
    "diagnostics": false,
    "workers": 1
  },
  "environment": {
    "python_version": "3.13.3",
    "xarray_version": "2026.4.0",
    "numpy_version": "2.4.4",
    "geopandas_version": "1.1.3",
    "platform": "Windows-11-10.0.22631-SP0",
    "script_commit": "unknown"
  },
  "stages": [
    {
      "stage": "merge",
      "country": "eth",
      "variable": "tas",
      "scenario": "historical",
      "command": "D:\\IRLI\\climate-agent\\climate-agent-env\\Scripts\\python.exe D:\\IRLI\\climate-agent\\scripts\\run_historical_workflow.py --country ethiopia --variable temp --start-year 2010 --end-year 2025 --max-workers 1",
      "finished_at": "2026-05-06T22:46:38.302330+00:00",
      "exit_code": 0,
      "attempt": 1,
      "status": "SUCCESS",
      "input_files": [],
      "output_file": "",
      "validation": {
        "ethiopia_temp_2010_2025_025deg_clipped.nc": {
          "existence": "OK",
          "variable_present": "OK",
          "non_nan_coverage": "OK",
          "time_coverage": "OK",
          "daily_axis": "OK",
          "units": "SKIP",
          "grid_match": "SKIP",
          "spatial_bounds": "SKIP"
        }
      },
      "stdout_tail": "Time steps: 5844\nLoaded source dataset from: data\\merged_files\\ethiopia_temp_2010_2025.nc\nApplied variable renaming and regridding using target grid: data\\merged_files\\ethiopia_pr_2010_2025.nc (method=linear).\nWrote output file: data\\merged_files\\ethiopia_temp_2010_2025_025deg.nc\nInput: data\\merged_files\\ethiopia_temp_2010_2025_025deg.nc\nBoundary: data\\boundaries\\ethiopia_adm0.geojson\nOutput: data\\merged_files\\ethiopia_temp_2010_2025_025deg_clipped.nc\n\n=== ethiopia historical temp ===\nRunning merge step...\n$ D:\\IRLI\\climate-agent\\climate-agent-env\\Scripts\\python.exe codes/merge_netcdf_ethiopia_temperature.py --input-dir data/ethiopia_temperature/netcdf --output data/merged_files/ethiopia_temp_2010_2025.nc\nCompleted in 10m 38.4s\nRunning rename/regrid step...\n$ D:\\IRLI\\climate-agent\\climate-agent-env\\Scripts\\python.exe codes/rename_and_regrid_netcdf.py --source data/merged_files/ethiopia_temp_2010_2025.nc --target-grid data/merged_files/ethiopia_pr_2010_2025.nc --output data/merged_files/ethiopia_temp_2010_2025_025deg.nc --method linear --compression-level 0\nCompleted in 4.28s\nRunning clip step...\n$ D:\\IRLI\\climate-agent\\climate-agent-env\\Scripts\\python.exe codes/clip_netcdf_by_shapefile.py --input data/merged_files/ethiopia_temp_2010_2025_025deg.nc --boundary data/boundaries/ethiopia_adm0.geojson --output data/merged_files/ethiopia_temp_2010_2025_025deg_clipped.nc --compression-level 1\nCompleted in 3.66s\n\nHistorical workflow completed successfully.",
      "stderr_tail": "",
      "error_message": "",
      "fallback_used": false,
      "fallback_path": ""
    }
  ],
  "summary": {
    "total_slices": 1,
    "succeeded": 1,
    "failed": 0,
    "warnings": 0,
    "skipped": 0,
    "duration_seconds": 650.2,
    "failed_slices": [],
    "output_files": [
      "D:\\IRLI\\climate-agent\\data\\merged_files\\ethiopia_temp_2010_2025_025deg_clipped.nc"
    ],
    "diagnostic_files": []
  }
}