{
  "run_id": "run_20260509_135031",
  "timestamp": "2026-05-09T13:50:31.859985+00:00",
  "request": {
    "countries": [
      "eth"
    ],
    "variables": [
      "pr"
    ],
    "scenario": "ssp245",
    "period": [
      2040,
      2070
    ],
    "quality_level": "strict",
    "diagnostics": true,
    "workers": 1,
    "diagnostics_only": false
  },
  "environment": {
    "python_version": "3.13.3",
    "xarray_version": "2026.4.0",
    "numpy_version": "2.4.4",
    "geopandas_version": "1.1.3",
    "platform": "Windows-11-10.0.22631-SP0",
    "script_commit": "de9d8d3",
    "agent_config_hash": "sha256:cf198da6eef2f90b"
  },
  "stages": [
    {
      "stage": "regrid",
      "country": "eth",
      "variable": "pr",
      "scenario": "ssp245",
      "command": "D:\\IRLI\\climate-agent\\climate-agent-env\\Scripts\\python.exe D:\\IRLI\\climate-agent\\scripts\\run_projection_workflow.py --country ethiopia --scenario ssp_245 --variable pr --start-year 2040 --end-year 2070 --max-workers 1 --run-diagnostics",
      "finished_at": "2026-05-09T13:50:58.666781+00:00",
      "exit_code": 0,
      "attempt": 1,
      "status": "SUCCESS",
      "input_files": [],
      "output_file": "",
      "validation": {
        "ethiopia_pr_ssp245_2040_2070_025deg_clipped.nc": {
          "existence": "OK",
          "variable_present": "OK",
          "non_nan_coverage": "OK",
          "time_coverage": "OK",
          "daily_axis": "OK",
          "units": "OK",
          "grid_match": "SKIP",
          "spatial_bounds": "SKIP",
          "anomaly": "OK",
          "distribution": "OK"
        }
      },
      "stdout_tail": "- Value max: 227.4901\n- Value mean \u00b1 std: 2.4584 \u00b1 7.3154\n- Diagnostic plot written to: data\\merged_files_et\\diagnostics\\ethiopia_pr_ssp245_2040_2070_025deg_clipped_diagnostic.png\n- QC JSON sidecar written to: data\\merged_files_et\\diagnostics\\ethiopia_pr_ssp245_2040_2070_025deg_clipped_qc.json\n\n=== ethiopia ssp_245 pr ===\nRunning rename/regrid step...\n$ D:\\IRLI\\climate-agent\\climate-agent-env\\Scripts\\python.exe codes/rename_and_regrid_netcdf.py --source data/projection_data/isimip-download-ethiopia/ssp_245/pr --target-grid data/merged_files/ethiopia_pr_2010_2025.nc --output data/merged_files/ethiopia_pr_ssp245_2040_2070_025deg.nc --method linear --start-year 2040 --end-year 2070 --compression-level 0 --convert-pr-to-mm-day\nCompleted in 6.29s\nValidated rename/regrid output in 1.70s\nRunning clip step...\n$ D:\\IRLI\\climate-agent\\climate-agent-env\\Scripts\\python.exe codes/clip_netcdf_by_shapefile.py --input data/merged_files/ethiopia_pr_ssp245_2040_2070_025deg.nc --boundary data/boundaries/ethiopia_adm0.geojson --output data/merged_files/ethiopia_pr_ssp245_2040_2070_025deg_clipped.nc --compression-level 1\nCompleted in 6.85s\nValidated clipped output in 1.05s\nRunning diagnostics step...\n$ D:\\IRLI\\climate-agent\\climate-agent-env\\Scripts\\python.exe codes/diagnose_final_netcdf.py --file data/merged_files/ethiopia_pr_ssp245_2040_2070_025deg_clipped.nc --var pr --time-index 6416 --out-dir data/merged_files_et/diagnostics\nCompleted in 6.68s\nWorkflow slice completed in 22.73s\n\nWorkflow completed successfully.",
      "stderr_tail": "",
      "error_message": "",
      "fallback_used": false,
      "fallback_path": ""
    }
  ],
  "summary": {
    "total_slices": 1,
    "succeeded": 1,
    "failed": 0,
    "warnings": 0,
    "skipped": 0,
    "duration_seconds": 33.4,
    "failed_slices": [],
    "output_files": [
      "D:\\IRLI\\climate-agent\\data\\merged_files\\ethiopia_pr_ssp245_2040_2070_025deg_clipped.nc"
    ],
    "diagnostic_files": [
      "D:\\IRLI\\climate-agent\\data\\diagnostics\\run_20260509_135031\\ethiopia_pr_ssp245_2040_2070_025deg_clipped_diagnostic.png"
    ],
    "qc_stats": {
      "ethiopia_pr_ssp245_2040_2070_025deg_clipped.nc": {
        "generated_at": "2026-05-09T13:51:04.536590+00:00",
        "file_variable": "pr",
        "units": "mm/day",
        "dims": {
          "time": 11323,
          "lat": 45,
          "lon": 59
        },
        "grid": {
          "lat_step_deg": 0.25,
          "lon_step_deg": 0.25,
          "lat_direction": "ascending",
          "lon_direction": "ascending",
          "lat_min": 3.625,
          "lat_max": 14.625,
          "lon_min": 33.125,
          "lon_max": 47.625
        },
        "time": {
          "n_timesteps": 11323,
          "n_unique": 11323,
          "duplicate_count": 0,
          "missing_years": [],
          "n_missing_years": 0
        },
        "coverage": {
          "total_pixels": 30062565,
          "finite_pixels": 16735394,
          "nan_pixels": 13327171,
          "finite_ratio": 0.5567
        },
        "value_stats": {
          "min": 0.0,
          "p01": 0.0,
          "p05": 0.0,
          "p25": 0.0,
          "median": 0.0,
          "p75": 0.5738,
          "p95": 15.7442,
          "p99": 34.0984,
          "max": 227.4901,
          "mean": 2.4584,
          "std": 7.3154
        },
        "missing_fraction_by_timestep": {
          "min": 0.4433,
          "max": 0.4433,
          "mean": 0.4433,
          "n_timesteps_above_20pct": 11323,
          "n_timesteps_above_50pct": 0
        },
        "source_file": "D:\\IRLI\\climate-agent\\data\\merged_files\\ethiopia_pr_ssp245_2040_2070_025deg_clipped.nc"
      }
    }
  }
}